 "title" , "beschrijving" ,
 "Paneel met wapenschild in maaswerk" , "Massief paneel met gevlamd maaswerk. Maaswerk met visblaasmotieven was kenmerkend voor het laatgotische raamwerk van vensters. Centraal op het paneel is een gekroond wapenschild afgebeeld met drie Franse lelies. Op de brede bovenrand zijn verbindingsgaten te zien. Op de achterkant van het paneel werd een versiering ingekrast. " ,
 "Briefpaneel met accoladebogen" , "Massief briefpaneel met meerdere ruggen, aan de uiteinden versierd met accoladebogen opgevuld met bloemtakken." ,
 "Wandrek met 7 haken" , "Dit wandrek met zeven haken is versierd met verschillende lijsten. Aan de haken en op de plank werd vermoedelijk vaatwerk gehangen en geplaatst. De sterk geprofileerde kroonlijst wordt gedragen door drie gesneden leeuwenkoppen omringd door knorren. Onder elke leeuwenkop is een rozet aangebracht, versierd met kopnagels. Verder wordt het wandrek versierd met schubben en onderaan een geholde tandlijst. " ,
 "Paneel met ajour maaswerk" , "Massief paneel met opengewerkt maaswerk. Maaswerk was kenmerkend voor het gotische raamwerk van vensters." ,
 "Pyramid" , "Pyramid is een van de experimentele ladekasten die het oeuvre van Shirō Kuramata kenmerken. De transparante, piramidevormige ladekast op wielen heeft zeventien zwarte lades met verschillende afmetingen. Wanneer de lades opengetrokken zijn, lijken ze te zweven in de ruimte. Pyramid heeft een monumentaal en sculpturaal uitzicht, in het bijzonder tegen een witte achtergrond. Het meubel is een vroeg voorbeeld van Kuramata's 'design object', een term die de Japanse kunstenaar en kunstcriticus Katsuhiro Yamaguchi gebruikte om het werk van Kuramata te omschrijven." ,
 "Paneel met Apollo" , "Paneel met een voorstelling van Apollo die in een olijfboom verandert. Deze afbeelding is afkomstig uit een serie prenten van de hand van Antonio Tempesta uit 1606, ter illustratie van Ovidius' Metamorfosen. Het paneel is mogelijk afkomstig van een vermoedelijk 17de-eeuwse Antwerpse kunstkast, waarvan ook het gelijkaardige paneel met een voorstelling van Apollo en Cyparissus uit de collectie van het museum zou zijn." ,
 "Paneel met ajour maaswerk" , "Massief paneel met opengewerkt maaswerk. Maaswerk  was kenmerkend voor het gotische raamwerk voor vensters. Als achtergrond werd een stuk textiel aan het paneel toegevoegd. De opbouw van het paneel vertoont sterke gelijkenissen met een ander paneel in de collectie van het museum." ,
 "Paneel met centrale dubbele bloem" , "Massief paneel met centrale dubbele bloem omgeven door gestileerde arabesken. Op een van de lange zijden ontbreekt ongeveer 2 cm van de versiering. " ,
 "Paneel met maaswerk" , "Massief paneel met gevlamd maaswerk met bovenaan acanthusbladeren. Maaswerk met visblaasmotieven was kenmerkend voor het laatgotische raamwerk van vensters." ,
 "Fragment van een paneel" , "Fragment van een massief paneel met een versiering van verschillende slingers die in elkaar vervlochten werden. Aan de rechterkant werd een portret gesneden." ,
 "Paneel met lederversiering en bladwerk" , "Massief paneel met X-motief en bladwerk." ,
 "Paneel met wapenschild in maaswerk" , "Massief paneel met gevlamd maaswerk, ingesloten in een accoladeboog bekroond met kruisbloemen. Maaswerk met visblaasmotieven was kenmerkend voor het laatgotische raamwerk van vensters. Centraal op het paneel is een wapenschild afgebeeld waarvan de wapenfiguren zijn weggekrabd. Rondom het maaswerk is een v-vormige kantlijst aangebracht en werd een brede rand vrij gelaten.  " ,
 "Fragment van een paneel met wapenschild in maaswerk" , "Fragment van een massief paneel met gotisch maaswerk. Het paneel is ingedeeld in vier verticale stroken die van links naar rechts een roosvenster boven spitsbogen, een Bourgondische vuurslag, een gekroond wapenschild met drie Franse lelies en een gestileerde Franse lelie voorstellen, verwerkt in het maaswerk. De Bourgondische vuurslag werd veelvuldig gebruikt in de politieke propaganda van de Bourgondiërs. Met een vuurslag kunnen vonken van een vuursteen worden geslagen. " ,
 "Vrouwelijke kariatide" , "Massieve vrouwelijke kariatide die vermoedelijk diende als ondersteuning en decoratie van een Vlaamse buffetkast. Ook de rugzijde is versierd. Een gelijkaardige mannelijke kariatide in de collectie van het museum is vermoedelijk afkomstig van hetzelfde meubel." ,
 "Hermenfiguur" , "Hermenfiguur die mogelijk onderdeel was van een meubel." ,
 "Rococo ornament" , "Dit massief ornament is uitgewerkt in rococo of Louis XV-stijl, bijvoorbeeld met rocaille en bladwerk. Mogelijk was dit een meubelfragment." ,
 "Paneel met centraal portretmedaillon " , "Massief paneel met vrouwenportret in een centraal medaillon. Het eenvoudige medaillon is omgeven door arabesken." ,
 "Paneel met wapenschild" , "Massief paneel met centraal een wapenschild en de datering 1627. Het wapenschild wordt geflankeerd door een gevleugelde leeuw. Links en rechts werd het paneel versierd met knorren. " ,
 "Paneel met 'Leda en de zwaan'" , "Massief paneel met een voorstelling van 'Leda en da zwaan'. Links werd een brede ruimte vrij gelaten. " ,
 "Paneel met vlechtwerk" , "Massief paneel met sterk opengewerkte gevlochten banden met druivenranken en acanthusbladeren. Het paneel bestaat uit twee delen, aan de rugzijde aan elkaar vastgemaakt." ,
 "Paneel met lederversiering en bladwerk" , "Massief paneel met X-motief en bladwerk. " ,
 "Stoel met rieten zitting en rugleuning" , "Deze stoel met rieten zitting en rugleuning werd aan de voorzijde versierd met symmetrisch snijwerk. De rugleuning is hoog en licht gekromd. Deze lichte welving, die uit Engeland komt overwaaien, moest het zitten aangenamer maken. De S-vormige poten vooraan zijn verbonden en hebben uitgesproken knieën. De achterpoten, die niet versierd werden met snijwerk, lopen zonder onderbreking over in de stijlen van de rugleuning. Stilistisch sluit de stoel aan bij de 18de-eeuwse Lodewijk XIV-stijl en tegelijk bij de Engelse William en Mary-stijl. Het riet en de uiteinden van de voorpoten werden vernieuwd. " ,
 "Stoel met rieten zitting en rugleuning" , "Deze stoel met rieten zitting en rugleuning werd aan de voorzijde versierd met symmetrisch snijwerk. De rugleuning is hoog en licht gekromd. Deze lichte welving, die uit Engeland komt overwaaien, moest het zitten aangenamer maken. De S-vormige poten vooraan zijn verbonden en hebben uitgesproken knieën. De achterpoten, die niet versierd werden met snijwerk, lopen zonder onderbreking over in de stijlen van de rugleuning. Stilistisch sluit de stoel aan bij de 18de-eeuwse Lodewijk XIV-stijl en tegelijk bij de Engelse William en Mary-stijl. Het riet en de uiteinden van de voorpoten werden vernieuwd. " ,
 "Briefpaneel" , "Het paneel bestaat uit vier briefpanelen afgewerkt met acanthusbladeren, vastgemaakt in een geraamte van twee stijlen en vijf korte dwarsliggers. In de tentoonstellingscatalogus van 1982 ('Gotische meubels, meubelfragmenten en textiel uit eigen verzamelingen') wordt aangegeven dat dit de zijkant van een kast zou zijn, maar in het waarderingstraject van 2018 werd dit benoemd als lambrisering." ,
 "Ornament met rozet" , "Massief ornament in de vorm van een rozet. " ,
 "Zuil met rozetten" , "Massieve zuil die vermoedelijk diende als ondersteuning en decoratie van een kast. De zuil is aan elke zijde versierd met rozetten. " ,
 "Fragment van een paneel met centraal portretmedaillon" , "Fragment van een massief paneel met een centraal portretmedaillon. Het medaillon is omgeven door grotesken, waaronder een fantastisch masker bovenaan. " ,
 "Paneel met maaswerk" , "Massief paneel met gevlamd maaswerk, bestaande uit acanthusbladeren boven een accoladeboog en visblazen. Maaswerk met visblaasmotieven was kenmerkend voor het laatgotische raamwerk van vensters." ,
 "Zuil met vergulde druivenrank" , "Getorste zuil versierd met een druivenrank uit stucwerk. Het kapiteel bestaat uit bladwerk." ,
 "Kleerkast voor Villa Les Glycines" , "Aan het einde van zijn leven kreeg de Brusselse art-nouveau-architect Paul Hankar de opdracht om een buitenverblijf en atelier te ontwerpen voor de bevriende edelsmid Philippe Wolfers. Die had in 1899 samen met zijn broer Max en hun neef Albert een domein gekocht in Terhulpen waar ze elk een cottage lieten bouwen. Deze kleerkast is vermoedelijk afkomstig uit Villa Les Glycerines, wat blauweregen betekent, maar het is niet duidelijk of de kast ook voor deze villa ontworpen werd. De kleerkast werd vermoedelijk ontworpen door Émile Van Nooten, leerling en later medewerker van Paul Hankar. Van Nooten voltooide de binnenafwerking van de villa na Hankars dood. Deze toeschrijving is echter hypothetisch. Het spel van licht en donker hout en de gestileerde onderdelen zijn terugkerende elementen in ook de andere meubels van de villa, maar de slaapkamermeubels hebben een vloeiender lijnenspel in de vlakvullingen. Van hetzelfde slaapkamerensemble bewaart het museum nog een identieke kast en een toilettafel. Uit het rooksalon van de villa worden drie stoelen en een kruk in japonistische stijl bewaard." ,
 "Kleerkast voor Villa Les Glycines" , "Aan het einde van zijn leven kreeg de Brusselse art-nouveau-architect Paul Hankar de opdracht om een buitenverblijf en atelier te ontwerpen voor de bevriende edelsmid Philippe Wolfers. Die had in 1899 samen met zijn broer Max en hun neef Albert een domein gekocht in Terhulpen waar ze elk een cottage lieten bouwen. Deze kleerkast is vermoedelijk afkomstig uit Villa Les Glycerines, wat blauweregen betekent, maar het is niet duidelijk of de kast ook voor deze villa ontworpen werd. De kleerkast werd vermoedelijk ontworpen door Émile Van Nooten, leerling en later medewerker van Paul Hankar. Van Nooten voltooide de binnenafwerking van de villa na Hankars dood. Deze toeschrijving is echter hypothetisch. Het spel van licht en donker hout en de gestileerde onderdelen zijn terugkerende elementen in ook de andere meubels van de villa, maar de slaapkamermeubels hebben een vloeiender lijnenspel in de vlakvullingen. Van hetzelfde slaapkamerensemble bewaart het museum nog een identieke kast en een toilettafel. Uit het rooksalon van de villa worden drie stoelen en een kruk in japonistische stijl bewaard." ,
 "Tafeltje met geslingerde poten" , "Dit tafeltje met een fijn uitgewerkt rechthoekig tafelblad steunt op getroste poten, onderaan verbonden met een H-verbinding. " ,
 "Boterschaaltje 200 Seagull" , "Boterschaaltje modelnummer 200 behorende tot het servies Seagull met gouden randjes. De serviesonderdelen zijn klassiek van vorm, maar het decor sluit aan bij een nieuw thema dat de art nouveau aanboorde, met name de natuur. Op een dégradé blauwe achtergrond zweeft een zeemeeuw door het luchtruim, zeepaardjes fungeren als handvatten van schalen en kommen. Het model van het servies - met schubbenmotief in reliëf - dateert uit de jaren 1880 en is van August Hallin. Het decor met de zeemeeuw is van de hand van Fanny Garde en dateert van 1895. Vanaf de jaren 1950 was het servies in één op tien Deense huishoudens te vinden, waardoor het werd bestempeld als het 'nationale Deense servies'. Er bestaat ook een versie zonder gouden randje." ,
 "Kruk met ingesnoerde vaasvormige poten" , "Deze kruk steunt op ingesnoerde vaasvormige potendie door een x-vormig stel regels verbonden zijn. De vernieuwde bekleding is vastgemaakt met stoffeernagels die een decoratief patroon vormen rondom de zitting. " ,
 "Stoel met opengewerkte rugleuning" , "Deze stoel met een vernieuwde beklede zitting heeft een rugleuning met een opengewerkte rug en een geaccentueerde handgreep met snijwerk. De lichte welving van de hoge rugleuning, die uit Engeland komt overwaaien, moest het zitten aangenamer maken. Verbindingen tussen de poten worden in het begin van de 18de eeuw stilaan overbodig: de gekromde overhoeks geplaatste poten, die hier eindigen op hoefjes, zorgen ervoor dat de stoel stabiel kan blijven, ook zonder sporten of verbindingen. Een vergelijkbare stoel is te vinden in de collectie van Hôtel de Groesbeeck de Croix in Namen." ,
 "Stoel met opengewerkte rugleuning" , "Deze stoel met een vernieuwde beklede zitting heeft een rugleuning met een opengewerkte rug en een geaccentueerde handgreep met snijwerk. De lichte welving van de hoge rugleuning, die uit Engeland komt overwaaien, moest het zitten aangenamer maken. Verbindingen tussen de poten worden in het begin van de 18de eeuw stilaan overbodig: de gekromde overhoeks geplaatste poten, die hier eindigen op hoefjes, zorgen ervoor dat de stoel stabiel kan blijven, ook zonder sporten of verbindingen. Een vergelijkbare stoel is te vinden in de collectie van Hôtel de Groesbeeck de Croix in Namen." ,
 "Secrétaire à abattant in empirestijl" , "Deze 'secrétaire à abattant' is zowel een schrijf- als een bergmeubel. In gesloten toestand is het geheel blokvormig met vlakke zijden, voornamelijk versierd door het beslag met kransmotief en de overhoeks geplaatste zuilen in empirestijl. Het schrijfblad, dat de bovenkast afsluit, kan worden neergelaten ('à abattant') waardoor verschillende kleine lades en vakjes tevoorschijn komen. Deze en vaak ook verborgen laatjes, bewaarden allerlei schrijfbenodigdheden en geheimen, zogenaamde 'secrets', waaraan het meubel zijn naam dankt. Dit type bureau werd heel populair in de tweede helft van de 18de eeuw en in de eerste decennia van de 19de eeuw. Vergelijkbare meubels zijn te vinden in de collecties van Letterenhuis in Antwerpen, Museum Kunst & Geschiedenis in Brussel en Victoria and Albert Museum in Londen." ,
 "Secrétaire à abattant in empirestijl" , "Deze 'secrétaire à abattant' is zowel een schrijf- als een bergmeubel. In gesloten toestand is het geheel blokvormig met vlakke zijden, voornamelijk versierd door het beslag met kransmotief en de overhoeks geplaatste zuilen in empirestijl. Het schrijfblad, dat de bovenkast afsluit, kan worden neergelaten ('à abattant') waardoor verschillende kleine lades en vakjes tevoorschijn komen. Deze en vaak ook verborgen laatjes, bewaarden allerlei schrijfbenodigdheden en geheimen, zogenaamde 'secrets', waaraan het meubel zijn naam dankt. Dit type bureau werd heel populair in de tweede helft van de 18de eeuw en in de eerste decennia van de 19de eeuw. Vergelijkbare meubels zijn te vinden in de collecties van Letterenhuis in Antwerpen, Museum Kunst & Geschiedenis in Brussel en Victoria and Albert Museum in Londen." ,
 "Spaanse mansstoel met siernagels en leeuwenkoppen" , "Deze stoel heeft een hoge zitting en een lange rugleuning, wat kenmerkend is voor stoelen uit de barok. De statige stoel dankt zijn uitstraling aan de lederen bekleding die werd vastgemaakt met metalen nagels en de twee leeuwenkopjes die de achterpoten bekronen. De stoffeernagels met verschillende maten zijn in decoratieve bloemen aangebracht. De achterpoten lopen zonder onderbreking door in de stijlen van de rugleuning. De lederen zitting is in het midden versierd met een vierkant. Enkele onderdelen zoals de voorsport werden vermoedelijk vernieuwd. Een Spaanse stoel dankt zijn naam aan de lederen bekleding die oorspronkelijk uit het Spaanse Cordoba kwam. Omdat de Nederlanden onder Spaans bewind stonden, kwamen de stoelen er vaak voor. Vergelijkbare stoelen zijn te vinden in de collecties van Museum Vleeshuis in Antwerpen, het Gruuthusemuseum in Brugge, Museum Kunst & Geschiedenis in Brussel, Museum Hof van Busleyden in Mechelen en MOU in Oudenaarde." ,
 "Nuages" , "Deze gordijnstof in linnenbinding heeft een patroon van horizontale wolkenbanden in wit, violet en tinten rood. Deze velden worden met stippen en blokjes van wisselende grootte en kleurintensiteit ingevuld volgens een bepaald systeem om diepte te creëren. De vormgeving is beïnvloed door op art." ,
 "Nuages" , "Deze gordijnstof in linnenbinding heeft een patroon van horizontale wolkenbanden in wit, violet en tinten rood. Deze velden worden met stippen en blokjes van wisselende grootte en kleurintensiteit ingevuld volgens een bepaald systeem om diepte te creëren. De vormgeving is beïnvloed door op art." ,
 "Sorrento" , "Het patroon van deze lap gordijnstof vertoont een compositie met twee opvliegende meeuwen.
De kleurstelling bestaat uit lichtbeige, zwart, oranje, mosgroen, mosterdgeel, grijs, wit. Patroonnr.: 409/26612-501 of 503" ,
 "Boreale nr. 12" , "Het patroon, ontworpen door Octave Landuyt, maakt deel uit van de reeks 'Hartprints' van Herman Hart & Co. Deze Nederlandse firma, gespecialiseerd in gordijnstoffen, gaf aan diverse kunstenaars, zoals Landuyt en leden van de Cobra-beweging, de opdracht om dessins te ontwerpen. Het patroon van deze lap gordijnstof bestaat uit verspringende verticale rijen met een rond siermotief dat een opgerolde fossiele vis evoceert. De kleurencombinatie bestaat uit bruin, oranje, mosgroen en verschillende tinten grijsblauw. Patroon nr.: 35/0745/1." ,
 "Onderkast van schrijfkabinet met symmetrisch snijwerk" , "Dit schrijfkabinet bestaat uit een onderkast die dienst doet als schrijfbureau en een bovenkast die wordt gebruikt als bergmeubel. In de onderkast zijn drie golvende lades aangebracht onder een neerklapbaar blad waarachter zich twee kleinere lades bevinden. Het geheel is symmetrisch versierd, onder meer met beslag rond de sleutelgaten. De bovenkast van dit schrijfkabinet is bekroond met een golvende geprofileerde kroonlijst met een centraal kuifstuk in de vorm van een rocaille. Dergelijke schrijfkabinetten waren een populair meubeltype in de Zuidelijke Nederlanden en het Prinsbisdom Luik. Vergelijkbare onderkasten zijn te vinden in de collecties van het Ansembourg Museum in Luik en Hôtel de Groesbeeck de Croix in Namen." ,
 "Paneel met ajour maaswerk" , "Massief paneel met opengewerkt maaswerk. Maaswerk was kenmerkend voor het gotische raamwerk van vensters. De opbouw van het paneel toont sterke gelijkenissen met een ander paneel in de collectie van het museum." ,
 "Bovenkast van schrijfkabinet met symmetrisch snijwerk" , "Dit schrijfkabinet bestaat uit een onderkast die dienst doet als schrijfbureau en een bovenkast die wordt gebruikt als bergmeubel. In de onderkast zijn drie golvende lades aangebracht onder een neerklapbaar blad waarachter zich twee kleinere lades bevinden. Het geheel is symmetrisch versierd, onder meer met beslag rond de sleutelgaten. De bovenkast van dit schrijfkabinet is bekroond met een golvende geprofileerde kroonlijst met een centraal kuifstuk in de vorm van een rocaille. Dergelijke schrijfkabinetten waren een populair meubeltype in de Zuidelijke Nederlanden en het Prinsbisdom Luik. Vergelijkbare meubels zijn te vinden in de collecties van Museum Vleeshuis in Antwerpen en Museum Kunst & Geschiedenis in Brussel, Museum Hof van Busleyden in Mechelen en Museum Mayer van den Bergh in Antwerpen." ,
 "Bovenkast van schrijfkabinet met symmetrisch snijwerk" , "Dit schrijfkabinet bestaat uit een onderkast die dienst doet als schrijfbureau en een bovenkast die wordt gebruikt als bergmeubel. In de onderkast zijn drie golvende lades aangebracht onder een neerklapbaar blad waarachter zich twee kleinere lades bevinden. Het geheel is symmetrisch versierd, onder meer met beslag rond de sleutelgaten. De bovenkast van dit schrijfkabinet is bekroond met een golvende geprofileerde kroonlijst met een centraal kuifstuk in de vorm van een rocaille. Dergelijke schrijfkabinetten waren een populair meubeltype in de Zuidelijke Nederlanden en het Prinsbisdom Luik. Vergelijkbare meubels zijn te vinden in de collecties van Museum Vleeshuis in Antwerpen en Museum Kunst & Geschiedenis in Brussel, Museum Hof van Busleyden in Mechelen en Museum Mayer van den Bergh in Antwerpen." ,
 "Vogue" , "Deze gordijnstof in linnenbinding heeft een patroon met kruisende banden op een witte achtergrond. De banden zijn samengesteld uit stroken in wit, beige, oranje en tinten bruin volgens gebogen en krullende lijnen. Hierbij overlappen ze elkaar. De kleurencombinatie was typisch voor die periode." ,
 "Paneel met centraal portretmedaillon" , "Massief paneel met mannenportret in een centraal medaillon. Het medaillon is omgeven door grotesken en arabesken." ,
 "Kastdeur met snijwerk" , "Deze kastdeur uit twee delen is versierd met snijwerk van vier figuren tussen rol- en bladwerk. Deze versiering is kenmerkend voor de overgang van barok naar rococo: zo is er bijvoorbeeld een aanzet tot rocailleschelpen te zien. Aan de rechterkant bevindt zich een sleutelgat en aan de twee zijkanten bevinden zich telkens twee scharnieren. " ,
 "Secrétaire à abattant in empirestijl" , "Deze 'secrétaire à abattant' is zowel een schrijf- als een bergmeubel. In gesloten toestand is het geheel blokvormig met vlakke zijden, voornamelijk versierd door het beslag en de zuilen in empirestijl. Het schrijfblad, dat de bovenkast afsluit, kan worden neergelaten ('à abattant') waardoor verschillende kleine lades en vakjes tevoorschijn komen. Deze en vaak ook verborgen laatjes, bewaarden allerlei schrijfbenodigdheden en geheimen, zogenaamde 'secrets', waaraan het meubel zijn naam dankt. Dit type bureau werd heel populair in de tweede helft van de 18de eeuw en in de eerste decennia van de 19de eeuw." ,
 "Paneel met symmetrisch bladwerk" , "Massief paneel versierd met fijn symmetrisch bladwerk. De versiering wordt begrensd door een geprofileerde lijst." ,
 "Paneel met maaswerk" , "Fragment van een massief paneel met gevlamd maaswerk. Maaswerk was kenmerkend voor het gotische raamwerk van vensters. Vermoedelijk maakte het paneel deel uit van het voorbord van een kist. In de collectie van het museum bevindt zich ook het aanvullende deel van het paneel." ,
 "Schrijfkist met passietafereel" , "Deze schrijfkist of 'schrijflaey' met ijzeren handvaten is sober aan de buitenkant, maar binnenin versierd met fijn houtsnijwerk. Op de binnenzijde van de schrijfklep is de kruisiging van Christus afgebeeld. Rondom zijn de vier evangelisten als os, engel, leeuw en adelaar gesneden. In de bak zijn er onder meer krijgers rond fabeldieren en musicerende engelen afgebeeld. De iconografie, die ook bij laat-16de-eeuwse kantoren terug te vinden is, gaat hoogstwaarschijnlijk terug op gravures. Zie bijvoorbeeld de plooival in de gewaden van de figuren. In de fijne afbeelding is ook de datering van het object verborgen op een van de afgebeelde wimpels: het jaar 1519. De laatjes binnenin de bak zijn de voorloper van de zogenaamde 'secreten' of verborgen lades in kantoren. Er zijn resten van de authentieke lederen trekkers bewaard. Schrijfkisten zoals deze konden makkelijk worden verplaatst en meegenomen zoals een hedendaagse laptop. Vergelijkbare schrijfkisten zijn te vinden in de collecties van het Snijders & Rockoxhuis in Antwerpen en de Koninklijke Musea voor Kunst en Geschiedenis in Brussel." ,
 "Schrijfkist met passietafereel" , "Deze schrijfkist of 'schrijflaey' met ijzeren handvaten is sober aan de buitenkant, maar binnenin versierd met fijn houtsnijwerk. Op de binnenzijde van de schrijfklep is de kruisiging van Christus afgebeeld. Rondom zijn de vier evangelisten als os, engel, leeuw en adelaar gesneden. In de bak zijn er onder meer krijgers rond fabeldieren en musicerende engelen afgebeeld. De iconografie, die ook bij laat-16de-eeuwse kantoren terug te vinden is, gaat hoogstwaarschijnlijk terug op gravures. Zie bijvoorbeeld de plooival in de gewaden van de figuren. In de fijne afbeelding is ook de datering van het object verborgen op een van de afgebeelde wimpels: het jaar 1519. De laatjes binnenin de bak zijn de voorloper van de zogenaamde 'secreten' of verborgen lades in kantoren. Er zijn resten van de authentieke lederen trekkers bewaard. Schrijfkisten zoals deze konden makkelijk worden verplaatst en meegenomen zoals een hedendaagse laptop. Vergelijkbare schrijfkisten zijn te vinden in de collecties van het Snijders & Rockoxhuis in Antwerpen en Museum Kunst & Geschiedenis in Brussel." ,
 "Schrijfkist met passietafereel" , "Deze schrijfkist of 'schrijflaey' met ijzeren handvaten is sober aan de buitenkant, maar binnenin versierd met fijn houtsnijwerk. Op de binnenzijde van de schrijfklep is de kruisiging van Christus afgebeeld. Rondom zijn de vier evangelisten als os, engel, leeuw en adelaar gesneden. In de bak zijn er onder meer krijgers rond fabeldieren en musicerende engelen afgebeeld. De iconografie, die ook bij laat-16de-eeuwse kantoren terug te vinden is, gaat hoogstwaarschijnlijk terug op gravures. Zie bijvoorbeeld de plooival in de gewaden van de figuren. In de fijne afbeelding is ook de datering van het object verborgen op een van de afgebeelde wimpels: het jaar 1519. De laatjes binnenin de bak zijn de voorloper van de zogenaamde 'secreten' of verborgen lades in kantoren. Er zijn resten van de authentieke lederen trekkers bewaard. Schrijfkisten zoals deze konden makkelijk worden verplaatst en meegenomen zoals een hedendaagse laptop. Vergelijkbare schrijfkisten zijn te vinden in de collecties van het Snijders & Rockoxhuis in Antwerpen en Museum Kunst & Geschiedenis in Brussel." ,
 "Kapiteel met cartouche" , "Massief kapiteel met cartouche omringd door krullen en een schelp." ,
 "Paneel met rocaille" , "Massief paneel met een zo goed als symmetrische versiering met onder andere schubben, bladeren, bloemen en C-vormige krullen." ,
 "Nova Matic" , "Elektrisch strijkijzer met zwart en wit handvat van Nova. Zwarte draaiknop waarmee de temperatuur kon afgestemd worden op het te strijken soort textiel. Het Nova Matic strijkijzer verscheen in twee kleurcombinaties; zwart/bruin-wit of rood-wit (beiden aanwezig in de collectie)." ,
