 "title" , "beschrijving" ,
 "Boterschaaltje 200 Seagull" , "Boterschaaltje modelnummer 200 behorende tot het servies 'Seagull' met gouden randjes. De serviesonderdelen zijn klassiek van vorm, maar het decor sluit aan bij een nieuw thema dat de art nouveau aanboorde, met name de natuur. Op een dégradé blauwe achtergrond zweeft een zeemeeuw door het luchtruim, zeepaardjes fungeren als handvatten van schalen en kommen. Het model van het servies - met schubbenmotief in reliëf - dateert uit de jaren 1880 en is van August Hallin. Het decor met de zeemeeuw is van de hand van Fanny Garde en dateert van 1895. Vanaf de jaren 1950 was het servies in één op tien Deense huishoudens te vinden, waardoor het werd bestempeld als het 'nationale Deense servies'. Er bestaat ook een versie zonder gouden randje." ,
 "Vaas met hengsel" , "Vaas met hengsel in eierschaalporselein met een geschilderd decor van waterlelies. Het polychrome decor is voornamelijk in geeltinten uitgevoerd, op een crème ondergrond. Plantenranken slingeren zich over het oppervlak en het handvat.
Het vaasje draagt het werkordernummer 32, wat betekent dat het eind 1902 beschilderd is." ,
 "Broodbord 28 A Seagull" , "Broodbord modelnummer 28 A behorende tot het servies 'Seagull' met gouden randjes. De serviesonderdelen zijn klassiek van vorm, maar het decor sluit aan bij een nieuw thema dat de art nouveau aanboorde, met name de natuur. Op een dégradé blauwe achtergrond zweeft een zeemeeuw door het luchtruim, zeepaardjes fungeren als handvatten van schalen en kommen. Het model van het servies - met schubbenmotief in reliëf - dateert uit de jaren 1880 en is van August Hallin. Het decor met de zeemeeuw is van de hand van Fanny Garde en dateert van 1895. Vanaf de jaren 1950 was het servies in één op tien Deense huishoudens te vinden, waardoor het werd bestempeld als het 'nationale Deense servies'. Er bestaat ook een versie zonder gouden randje." ,
 "Vaas" , "Enigzins gedrukte steengoed vaas met loopglazuur. Het oppervlak is glad en egaal donkerbruin. Vanaf de hals druipt een onregelmatige dikke witte glazuur langs de buik naar beneden.
Jean Pointu was sterk geïnspireerd door de oosterse keramiek, wat zich uit in zowel de glazuren als de soberheid van vorm." ,
 "Champagneglas" , "Fluitglas voor champagne. Op de wanden van de glazen is een zweepslagmotief gegraveerd.
Léon Ledru ontwierp deze glazen voor Val-Saint-Lambert. Hij uitte zich hierin als een gelijkdenkende van Henry van de Velde, die zijn ontwerpen toejuichte.
Met dank aan prof. dr. Werner Adriaenssens, conservator Decoratieve Kunsten 20ste eeuw Koninklijke Musea voor Kunst en Geschiedenis Brussel, voor de informatie" ,
 "Melkkan" , "Melkkan behorend tot een éénpersoons theeservies in verzilverd metaal, ontworpen door Christopher Dresser en uitgevoerd door Hukin & Heath. Op de buik staat een wapenschildje." ,
 "Scheplepel" , "De binnenin vergulde lepelbak is vormgegeven als een knol waaruit een stengel groeit, die dienst doet als lepelsteel. In de lus gevormd door de verstrengelde stengel met bladeren ontluikt een exotische bloem." ,
 "Ontwerptekeningen theepot en melkkan Bambou" , "Twee ontwerptekeningen, één voor de theepot Bambou en één voor de melkkan Bambou. Dit zijn de enige bewaarde voorbeelden van japonistische ontwerpen getekend door Philippe Wolfers. Zowel qua vorm als decor liet hij zich door het Verre Oosten inspireren. Centraal op de flank van de conische theekan is een half open vouwwaaier (sensu) voorgesteld, op de melkkan een waaier op steel (uchiwa). De banderol over de waaiers biedt ruimte voor eventuele eigenaarsinitialen. Ze zijn omgeven door dauwbraamtakken met bloemen en rijpe vruchten. Zoals dat ook in botanische boeken vaak het geval was, zijn de diverse bloeistadia van de plant hier gelijktijdig afgebeeld. Functionele onderdelen als pootjes, greep, schenktuit en dekselknop imiteren bamboestengels. De ontwerpen zijn kleurrijk uitgewerkt in aquarel en gouache, wat een uitvoering in verguld zilver met niëllo en email kan doen vermoeden. Daarvan bestaat echter geen enkel tastbaar bewijs. Het Design museum Gent bezit het enige bekende theekannetje Bambou, uitgevoerd in monochroom zilver." ,
 "Doos" , "Klein eivormig doosje met deksel. Het doosje is vervaardigd in hout en volledig overtrokken met bewerkt leer. De wand is uitgewerkt in gestileerde bladmotieven, het deksel lijkt uitgewerkt tot een Edelweissbloem. In oude collectienotities wordt het decor omschreven als ""pomme d'acajou"".
Het Cleveland Museum of Art bezit een haast identieke doos (inv. 1997.263). - gesigneerd in leder aan onderzijde" ,
 "Wandarm voor de eigen woning van Hankar" , "Paul Hankar (1859-1901) ontwierp deze verguld smeedijzeren twee-armige wandarm met orchideemotief voor zijn eigen woning (1893) in de Defacqzstraat te Brussel. In 1902 was ze op de internationale tentoonstelling voor decoratieve kunsten te Turijn te zien in de kunstenaarsstudio die architect-ontwerpers Léon Sneyers (1877-1949) en Adolphe Crespin (1859-1944) in het Belgische paviljoen inrichtten als eerbetoon aan de pas overleden Hankar." ,
 "Malitte" , "Malitte bestaat uit verschillende vormen in polyurethaanschuim die tot een vierkante wand kunnen worden gestapeld of kunnen dienen als individuele zitelementen. Het flexibele zitsysteem werd ontworpen door Malitte Pope Matta, maar werd bekend als een ontwerp van haar man Roberto Matta, een van de belangrijkste Chileense vertegenwoordigers van surrealistische en abstract expressionistische schilderkunst." ,
 "Parfumfles Lelies" , "Fles van kristal met stop van zilver met decor van deels gestileerde lelie. Maakt deel uit van een 13-delige toiletset in reiskoffer. Vervaardigd door Wolfers Frères voor de Gebr. Friedländer te Berlijn." ,
 "Vaas" , "Vaas van doorzichtig groen glas met goudbruine oppervlakteversiering. De vaas heeft een afgerond rechthoekig lichaam op een ronde voet en met een ronde halsopening. De vier wanden zijn ingedeukt. Het lichaam van de vaas is gedecoreerd met een goudbruine laag, dat bewerkt is alsof het glas is afgeschilferd.
De vaas wacht nog op een preciezere toeschrijving aan een glasfabrikant." ,
 "Vaas met klaprozen" , "Balustervormige glazen vaas met onregelmatig golvende halsrand. Het doorzichtige groene glas is versierd met kriskras opgelegde bruin-groene draden van glas. Eén zijde is extra gedecoreerd met naturalistisch weergegeven klaprozenstengels in goudverf.
De vaas is waarschijnlijk vervaardigd in Bohemen, maar wacht nog op een preciezere toeschrijving aan een glasfabriek.
" ,
 "Vingerkom" , "Kristallen vingerkom met polychroom decor. De rand heeft een gouden biesje. Wand gedecoreerd met goudkleurig geometrisch motief bestaande uit twee horizontale lijntjes onderbroken door telkens vier vierkantjes. Tussen de vierkantjesmotieven een groter geel vierkant met ""opkomende zon"", waaraan een groene laurierkrans hangt." ,
 "Vingerkom" , "Kristallen vingerkom met polychroom decor. De rand heeft een gouden biesje. Wand gedecoreerd met goudkleurig geometrisch motief bestaande uit twee horizontale lijntjes onderbroken door telkens vier vierkantjes. Tussen de vierkantjesmotieven een groter geel vierkant met ""opkomende zon"", waaraan een groene laurierkrans hangt." ,
 "Wijnglas" , "Jugendstil wijnglas met polychroom decor. Kelk- en voetrand met gouden biesje. Kelk gedecoreerd met goudkleurig geometrisch motief dat de wand in vier verdeeld. Onder elk motief zes groene lindenblaadjes en twee streepjes. Tussen de motieven twee streepjes met eronder een gele bloem." ,
 "Knoop" , "Zilveren knoop met naturalistisch bloemmotief." ,
 "Amphora" , "Slanke vaas op kleine uitstaande voet, model nr. 210. Op een roomwitte faiencebasis is een geometrisch decor aangebracht in bruin, donkergeel en zwart. De decoratie is geconcentreerd op de hals en de voet. Andere vazen van hetzelfde model kunnen een andere kleurstelling hebben." ,
 "Vaas 282" , "Kleine steengoed vaas met drie oren, modelnummer 282. De matgeglazuurde vaas heeft een crèmekleurige ondergrond, waarover een groene glazuur loopt over de hals en de oren. Ook is meer oranje-rood gekleurde glazuur gebruikt, die her en der onder de groene laag zichtbaar is.
Het model en vooral de glazuur van de vaas wortelen nog sterk in de art-nouveautraditie." ,
 "Inktpot" , "Vierkante gekleurd glazen inktpot met turks aandoend rond getoept dekseltje. De wanden van de inktpot zijn gebold en de vier hoeken lopen naar boven in een punt. De kleurpoeders aangebracht in de wand zijn veglaasd in de oven en geven het oppervlak een decor van kleurvlekjes." ,
 "Nachttafel voor Villa Les Glycines" , "Aan het einde van zijn leven kreeg de Brusselse art-nouveau-architect Paul Hankar de opdracht om een buitenverblijf en atelier te ontwerpen voor de bevriende edelsmid Philippe Wolfers. Die had in 1899 samen met zijn broer Max en hun neef Albert een domein gekocht in Terhulpen waar ze elk een cottage lieten bouwen. Deze nachttafel is afkomstig uit Villa Les Glycerines, wat blauweregen betekent. Het spel van licht en donker hout en de gestileerde onderdelen zijn terugkerende elementen in ook de andere meubels van de villa. Het beslag en de opengewerkte panelen met vloeiende lijnen wijzen naar de art-nouveaustijl." ,
 "Nachttafel voor Villa Les Glycines" , "Aan het einde van zijn leven kreeg de Brusselse art-nouveau-architect Paul Hankar de opdracht om een buitenverblijf en atelier te ontwerpen voor de bevriende edelsmid Philippe Wolfers. Die had in 1899 samen met zijn broer Max en hun neef Albert een domein gekocht in Terhulpen waar ze elk een cottage lieten bouwen. Deze nachttafel is afkomstig uit Villa Les Glycerines, wat blauweregen betekent. Het spel van licht en donker hout en de gestileerde onderdelen zijn terugkerende elementen in ook de andere meubels van de villa. Het beslag en de opengewerkte panelen met vloeiende lijnen wijzen naar de art-nouveaustijl." ,
 "Drinkbeker met bladeren en katjes" , "Een geciseleerde tak met bladeren en katjes buigt zich rond de beker. Het Design museum Gent bezit twee sterk gelijkende bekers die verschillen in de uitvoering van de versiering (zie ook inv.nr. 87/447). Het Duitse waarborgmerk geeft aan dat de bekers voor de Duitse markt waren bestemd, waar het kwalitatieve Wolferszilver erg geliefd was bij de gefortuneerde burgerij." ,
 "Vaasje met slanke hals" , "Vaasje met slanke hals uitgevoerd in steengoed en voorzien van vaalbruine lopende glazuur" ,
 "Zetel van het zitsysteem 'Malitte'" , "Malitte bestaat uit verschillende vormen in polyurethaanschuim die tot een vierkante wand kunnen worden gestapeld of kunnen dienen als individuele zitelementen. Het flexibele zitsysteem werd ontworpen door Malitte Pope Matta, maar werd bekend als een ontwerp van haar man Roberto Matta, een van de belangrijkste Chileense vertegenwoordigers van surrealistische en abstract expressionistische schilderkunst." ,
 "Lambriseringsfragment met mascaron en vruchtenslinger" , "Bovenzijde van een massief lambriseringsfragment met een mascaron en vruchtenslinger." ,
 "Stoel met uitgesneden rugleuning" , "Deze stoel met een vernieuwde beklede zitting heeft een centrale uitgesneden rugleuning. De lichte welving van de hoge rugleuning, die uit Engeland komt overwaaien, moest het zitten aangenamer maken. Verbindingen tussen de poten worden in het begin van de 18de eeuw stilaan overbodig: de gekromde overhoeks geplaatste voorpoten, die hier eindigen op hoeven, zorgen ervoor dat de stoel stabiel kan blijven, ook zonder regels of verbindingen. Een vergelijkbare stoel is te vinden in de collectie van het Museum für Kunst und Gewerbe in Hamburg." ,
 "Vaas" , "Peervormige vaas in roodbakkend aardewerk met groene glazuur over een decoratie in donkere engobe. Op de wand van de vaas bevinden zich enkele uitgelengde S-vormige siermotieven die de uitgelengde peervorm van het object sterker accentueren. Deze motieven zijn moeilijk zichtbaar door de donkergroene dik lopende glazuur. Een vaas met een identieke vorm en afmetingen maar een andere kleur glazuur werd in 1976 door Thyl van de Velde, zoon van Henry van de Velde, geschonken aan het museum (inv.nr. 76/246)." ,
 "Dressoir met maaswerk en briefpanelen" , "Deze kast bestaat uit een boven- en een onderkast versierd met panelen ingewerkt in een raamwerk van regels en stijlen. De panelen in de bovenkast, waarvan één paneel in de centrale deur, zijn versierd met maaswerk. Aan de zijkanten van de bovenkast, evenals in de onderkast, zijn de panelen versierd met briefvulling. De lade tussen boven- en onderkast is versierd met bladwerk, een centrale uil en twee fantastische dieren. De hoekstijlen van de onderkast lopen door tot bovenaan. Delen van het hout en de constructie van de kast met onder andere draadnagels doen vermoeden dat de kast een 19de-eeuws exemplaar met enig 15de-eeuws paneelwerk is. Vergelijkbare kastmeubels zijn te vinden in de collecties van Museum Kunst & Geschiedenis in Brussel, Museum Hof van Busleyden in Mechelen en Museum Mayer van den Bergh in Antwerpen." ,
 "Dressoir met maaswerk en briefpanelen" , "Deze kast bestaat uit een boven- en een onderkast versierd met panelen ingewerkt in een raamwerk van regels en stijlen. De panelen in de bovenkast, waarvan één paneel in de centrale deur, zijn versierd met maaswerk. Aan de zijkanten van de bovenkast, evenals in de onderkast, zijn de panelen versierd met briefvulling. De lade tussen boven- en onderkast is versierd met bladwerk, een centrale uil en twee fantastische dieren. De hoekstijlen van de onderkast lopen door tot bovenaan. Delen van het hout en de constructie van de kast met onder andere draadnagels doen vermoeden dat de kast een 19de-eeuws exemplaar met enig 15de-eeuws paneelwerk is. Vergelijkbare kastmeubels zijn te vinden in de collecties van Museum Kunst & Geschiedenis in Brussel, Museum Hof van Busleyden in Mechelen en Museum Mayer van den Bergh in Antwerpen." ,
 "Vingerkom" , "Kristallen vingerkom met polychroom decor. De rand heeft een gouden biesje. Wand gedecoreerd met goudkleurig geometrisch motief bestaande uit twee horizontale lijntjes onderbroken door telkens vier vierkantjes. Tussen de vierkantjesmotieven een groter geel vierkant met ""opkomende zon"", waaraan een groene laurierkrans hangt." ,
 "Paneel met wapenschild in maaswerk" , "Massief paneel met gevlamd maaswerk. Maaswerk met visblaasmotieven was kenmerkend voor het laatgotische raamwerk van vensters. In het maaswerk werd een wapenschild met twee Franse lelies en twee dolfijnen afgebeeld. De versiering wordt begrensd door een sterk geprofileerde V-vormige kantlijst met in de hoeken een hoekkruis. Deze lijst wordt niet vervolledigd aan de onderkant, wat kenmerkend is voor gotische panelen." ,
 "Vaas met landschap" , "Afgeplatte ronde vaas in pâte de verre met vernauwde hals en kelkvormige halsopening. Het lichaam van de vaas is gedecoreerd met een geëtst landschap in groentinten op een haast witte ondergrond. Op de voorgrond van het landschap staat een grote loofboom, die een doorzicht biedt op een meer.
De combinatie van dit decor en model van Gallé is in meerdere kleurschakeringen uitgevoerd en was populair. Het decor komt ook op andere modellen voor.
" ,
 "Vaas met ridderspoor" , "Kleine vaas in cameoglas, gedecoreerd met ridderspoor (Delphinium). De bloemen en bladeren van de ridderspoor steken in donkergroen af tegen de geelgroene achtergrond.
De vaas dateert mogelijk van na 1914, maar ademt de geest van de art nouveau." ,
 "Paneel met maaswerk" , "Massief paneel met gevlamd maaswerk versierd met drie centrale platgedrukte rozetten. Maaswerk met visblaasmotieven was kenmerkend voor het laatgotische raamwerk van vensters." ,
 "Kapiteel met voluten en acanthusbladeren" , "Massief kapiteel met acanthusbladeren rond voluten." ,
 "Tegel uit een compositie van keramiektegels" , "Georges Blomme maakte dit werk tijdens zijn opleiding bij Carmen Dionyse aan het Provinciaal Hoger Instituut voor Kunstonderwijs in Hasselt." ,
 "Lucrèce" , "Bronzen buste van ""Lucrèce"" of Lucretia, de Romeinse vrouw die zelfmoord pleegde om haar eer te behouden.
De buste situeert zich in een reeks van beelden die Villanis maakte van beroemde en beruchte vrouwen uit de literatuur, de mythologie en de Bijbel, zoals Aïda, Judith, Dalila en Cendrillon. Villanis liet zijn sculpturen vaak door de Société des Bronzes de Paris gieten." ,
 "Ornament met waaier" , "Massief paneel uitgewerkt als een waaier met laurier. Hoewel het fragment klein is, was het mogelijk een meubelonderdeel." ,
 "Bovenste deel van een vargueno" , "Deze Spaanse vargueño, ook bekend onder de recentere benaming 'escritorio de Salamanca’, is een schrijfmeubel bestaande uit twee mobiele koffers met smeedijzeren handvaten. Het bovenste gedeelte is afgesloten door een neerklapbaar blad, versierd met uitgesneden en vergulde metalen platen in veelhoekige vormen, aangebracht op een rode fluwelen ondergrond. Het neergeklapte blad, steunend op twee schelpvormige dwarsstukken, dient als schrijftafel. Binnenin is de koffer samengesteld uit twaalf grote lades en een deurtje met daarachter drie kleinere lades. Het binnenwerk bestaat uit gebeeldhouwd en verguld hout afgewerkt met ivoren of benen inlegwerk en schelpvormige knoppen. De decoratie is kenmerkend voor de Spaanse mudejarstijl. De vargueno geldt als prototype van de 17de-eeuwse kunstkabinetten." ,
 "Paneel met centraal portretmedaillon en grotesken" , "Massief paneel met een vrouwenportret in een centraal medaillon. Het medaillon is omgeven door grotesken met bovenaan twee engelenkopjes. " ,
 "Paneel met ajour maaswerk" , "Massief paneel met opengewerkt maaswerk met visblaasmotief rond een centrale vierpas. Maaswerk met visblaasmotieven was kenmerkend voor het laatgotische raamwerk van vensters. Er zijn sporen van rode en groene verf en aan de lange zijden werd het paneel afgewerkt met een geprofileerde lijst." ,
 "Paneel met maaswerk" , "Massief paneel met gevlamd maaswerk versierd met rozetten. Maaswerk met visblaasmotieven was kenmerkend voor het laatgotische raamwerk van vensters. De opbouw van het paneel vertoont gelijkenissen met een ander paneel in de collectie van het museum." ,
 "Paneel met lambrekijn en acanthusbladeren" , "Massief paneel met symmetrisch acanthusbladwerk. Ook de profielen op de lange zijden werden uit hetzelfde hout gesneden. In het centrum is het paneel versierd met een lambrekijn; een drapering met drie kwasten. Tussen de acanthusbladeren werden verschillende kleine bloemen gesneden." ,
 "Paneel met centraal portretmedaillon en bladwerk" , "Massief paneel met mannenportret in een centraal medaillon. Boven en onder het medaillon is het paneel versierd met bladwerk en voluten. " ,
 "Paneel met vrouw in een nis" , "Massief paneel met een vrouw in een nis. De figuur steekt haar linkerhand op. De nis is links en rechts geflankeerd door een gestileerde vogel, mogelijk een pelikaan, en bovenop de nis staat vermoedelijk een adelaar met geopende vleugels." ,
 "Paneel met centraal portretmedaillon" , "Massief paneel met mannenportret in een centraal medaillon. Boven het medaillon is het paneel versierd met een gevleugelde draak." ,
 "Paneel met maaswerk" , "Massief paneel met maaswerk versierd met visblaasmotieven en een lelie. Maaswerk met visblaasmotieven was kenmerkend voor het laatgotische raamwerk van vensters. " ,
 "Paneel met maaswerk" , "Massief paneel met maaswerk met bovenaan vijf rozetten. Maaswerk was kenmerkend voor het gotische raamwerk van vensters. De versiering wordt begrensd door een V-vormige kantlijst met in elke hoek een hoekkruis. Op de brede bovenrand zijn sporen te zien van de aanzettekening en 14 verbindingsgaten. " ,
 "Paneel met portretmedaillon" , "Massief paneel met vrouwenportret in een medaillon. Onder het medaillon is het paneel versierd met een lederversiering. De zwikken boven het medaillon zijn opgevuld met bladwerk." ,
 "Paneel met ajour vlechtwerk" , "Massief paneel met ajour vlechtwerk met twee rozetten. Als achtergrond werd een stuk fluweel aan het paneel toegevoegd." ,
 "Paneel met Apollo en Cyparissus" , "Paneel met een voorstelling van Apollo die Cyparissus in een boom verandert. Deze afbeelding is afkomstig uit een serie prenten van de hand van Antonio Tempesta uit 1606, ter illustratie van Ovidius' 'Metamorfosen'. Het paneel is mogelijk afkomstig van een vermoedelijk 17de-eeuwse Antwerpse kunstkast, waarvan ook het gelijkaardige paneel met een voorstelling van Apollo die in een olijfboom verandert uit de collectie van het museum afkomstig zou zijn. " ,
 "Paneel met 'De doodsangst van Christus in de hof van olijven'" , "Massief paneel met een voorstelling van Christus met op de achtergrond een rondboog op zuilen. Vermoedelijk wordt 'De doodsangst van Christus in de hof van olijven' afgebeeld. Op de brede bovenrand zijn verbindingsgaten te zien. In de collectie van het museum bevindt zich een paneel met een voorstelling van 'Jezus in de tempel' dat vermoedelijk van hetzelfde meubel afkomstig is of door hetzelfde atelier werd geproduceerd. " ,
 "Paneel met ajour maaswerk" , "Eenvoudig massief paneel met opengewerkt maaswerk. Maaswerk was kenmerkend voor het gotische raamwerk van vensters." ,
 "Paneel met 'Jezus in de tempel'" , "Massief paneel met een voorstelling van Christus met op de achtergrond een rondboog op zuilen. Vermoedelijk wordt 'De doodsangst van Christus in de hof van olijven' afgebeeld. In de collectie van het museum bevindt zich een paneel met een voorstelling van 'De doodsangst van Christus in de Hof van olijven' dat vermoedelijk van hetzelfde meubel afkomstig is of door hetzelfde atelier werd geproduceerd. " ,
 "Paneel met centraal portretmedaillon" , "Massief paneel met een mannenportret in een centraal medaillon. Het medaillon is omgeven door grotesken. Het paneel vormde vermoedelijk het voorbord van een lade. Op de linker- en rechterachterzijde zijn zwaluwstaartverbindingen zichtbaar. De vier randprofielen werden in verstek samengebracht. Aan de lange zijden werden ze uit het paneel zelf gesneden, terwijl ze aan de korte zijden met nagels aan het paneel bevestigd werden. Een gelijkaardig paneel met een vrouwenportret in een centraal medaillon in de collectie van het museum is vermoedelijk afkomstig van hetzelfde meubel." ,
 "Paneel met maaswerk" , "Massief paneel met gevlamd maaswerk met vier rozetten onder acanthusbladeren. Maaswerk met visblaasmotieven was kenmerkend voor het laatgotische raamwerk van vensters. De opbouw van het paneel vertoont sterke gelijkenissen met een ander paneel in de collectie van het museum." ,
 "Paneel met lederversiering en druivenranken" , "Massief paneel met X-motief en druivenranken. De aanzettekening is duidelijk zichtbaar. In het midden van elk druivenblad is de afdruk van een halfronde beitel te zien." ,
 "Paneel met lederversiering en bloemen" , "Massief paneel met X-motief en bloemen. " ,
 "Mannelijke kariatide" , "Massieve mannelijke kariatide die vermoedelijk diende als ondersteuning en decoratie van een Vlaamse buffetkast. Ook de rugzijde is versierd. Een gelijkaardige vrouwelijke kariatide in de collectie van het museum is vermoedelijk afkomstig van hetzelfde meubel. " ,
 "Briefpaneel" , "Eenvoudig massief briefpaneel met meerdere ruggen, versierd aan de uiteinden. " ,
 "Paneel met lederversiering en bladwerk" , "Massief paneel met X-motief en bladwerk. " ,
 "Paneel met bladmasker" , "Massief paneel met bladmasker. De zwaluwstaarten doen vermoeden dat het paneel deel was van een groter geheel." ,
 "Paneel met maaswerk" , "Massief paneel met gevlamd maaswerk met vier rozetten onder acanthusbladeren. Maaswerk met visblaasmotieven was kenmerkend voor het laatgotische raamwerk van vensters. De opbouw van het paneel vertoont sterke gelijkenissen met een ander paneel in de collectie van het museum. " ,
 "Figuur in antiquiserende kledij" , "Massieve mannelijke figuur in antiquiserende kledij die vermoedelijk diende als decoratie van een meubel of een retabel. Mogelijk is dit de bovenkant van een herme." ,
 "Paneel met maaswerk" , "Massief paneel met maaswerk met een centrale vierpas boven vier spitsbogen. Maaswerk was kenmerkend voor het gotische raamwerk van vensters." ,
 "Ornament met acanthusrozet" , "Massief ornament in de vorm van een rozet met acanthusbladeren. " ,
 "Opengewerkt paneel met bloemenvaas" , "Opengewerkt massief paneel met symmetrisch bladwerk en beginnende schelpmotieven rond een centrale bloemenvaas. Het paneel was mogelijk onderdeel van een ajour afsluiting." ,
 "Paneel met maaswerk" , "Massief paneel met maaswerk. Het maaswerk met een roosvenster boven spitsbogen gaat terug op het kenmerkende gotische raamwerk van vensters. " ,
 "Paneel met gehelmd wapenschild en acanthusbladeren" , "Massief paneel met een gehelmd wapenschild omgeven door acanthusbladeren. Zowel het helmteken bovenop de helm als het wapenfiguur is een adelaar. " ,
 "Paneel met centraal portretmedaillon" , "Massief paneel met mannenportret in een centraal medaillon. Het medaillon is omgeven door arabesken. " ,
 "Briefpaneel" , "Eenvoudig smal briefpaneel met één rug, versierd aan de uiteinden." ,
 "Paneel met maaswerk" , "Massief paneel met gevlamd maaswerk met visblazen en rozetten boven spitsbogen. Maaswerk met visblaasmotieven was kenmerkend voor het laatgotische raamwerk van vensters. " ,
